{
  "schema_version": "0.1",
  "protocol_version": "0.1",
  "manifest_id": "manifest-template-example",
  "frozen_at_utc": "2026-10-19T12:00:00Z",
  "extraction_environments": [
    {
      "environment_id": "environment-template-local",
      "label": "Synthetic local extraction environment (replace before use)",
      "host_type": "local_offline",
      "model_host": "Local research workstation",
      "processing_location": "United States",
      "provider_retention": "local_only",
      "provider_training": "not_applicable",
      "human_review": "not_applicable",
      "notes": "Template metadata only; document the actual frozen environment."
    }
  ],
  "resources": [
    {
      "resource_id": "resource-template-open",
      "resource_name": "Synthetic open archive (replace before use)",
      "supported_slots": [
        "C_TRADE",
        "C_GENERAL",
        "R_LATER",
        "S_ACADEMIC",
        "P_SYNOPSIS",
        "R_LATER_2"
      ],
      "access_status": "available",
      "access_mode": "open",
      "authentication_mode": "none",
      "authorized_user_scope": "public",
      "authorized_principal": "Public",
      "discovery_automation": "supported_api",
      "full_text_acquisition": "open_download",
      "tdm_permission": "allowed",
      "model_processing_permission": "allowed",
      "allowed_environment_ids": [
        "environment-template-local"
      ],
      "storage_permission": "public_redistribution_allowed",
      "export_permission": "full_source_allowed",
      "license_basis": "Synthetic placeholder; replace with an item- and provider-specific rights determination.",
      "license_reviewed_at": "2026-10-19",
      "retention_deadline": null,
      "documentation_urls": [
        "https://example.org/replace-with-rights-documentation"
      ],
      "rights_references": [
        {
          "rights_reference_id": "rights-template-open-terms",
          "reference_type": "provider_terms",
          "citation": "Synthetic provider terms placeholder; replace with the exact reviewed rights record.",
          "public_url": "https://example.org/replace-with-rights-documentation",
          "reviewed_at": "2026-10-19"
        }
      ],
      "notes": "This record demonstrates structure and is not evidence of real-world permission."
    }
  ],
  "source_system_inventory": [
  {
    "inventory_entry_id": "inventory-template-c-trade-variety",
    "slot": "C_TRADE",
    "source_system_code": "variety",
    "source_system_name": "Variety",
    "system_tier": 1,
    "system_rank": 1,
    "access_disposition": "available",
    "coverage_disposition": "documented_intervals",
    "assessed_resource_ids": [
      "resource-template-open"
    ],
    "coverage_intervals": [
      {
        "coverage_interval_id": "coverage-template-c-trade-variety",
        "date_dimension": "source_publication_or_issue_date",
        "start_date": "1900-01-01",
        "end_date": "2026-10-19",
        "start_issue": null,
        "end_issue": null,
        "resource_id": "resource-template-open",
        "evidence_basis": "other_documented",
        "evidence_note": "Synthetic fixture interval only; replace with provider- or holdings-specific evidence before retrieval.",
        "documentation_url": "https://example.org/replace-with-coverage-documentation",
        "checked_at": "2026-10-19"
      }
    ],
    "disposition_reason": null,
    "checked_at": "2026-10-19",
    "notes": "Template metadata only; this is not evidence of real archive holdings."
  },
  {
    "inventory_entry_id": "inventory-template-c-trade-hollywood-reporter",
    "slot": "C_TRADE",
    "source_system_code": "hollywood_reporter",
    "source_system_name": "The Hollywood Reporter",
    "system_tier": 1,
    "system_rank": 2,
    "access_disposition": "unavailable",
    "coverage_disposition": "not_verified",
    "assessed_resource_ids": [],
    "coverage_intervals": [],
    "disposition_reason": "Synthetic template marks this canonical system unavailable; replace with a dated real-world access or no-coverage determination before retrieval.",
    "checked_at": "2026-10-19",
    "notes": "Template metadata only; this is not evidence of real archive holdings."
  },
  {
    "inventory_entry_id": "inventory-template-c-trade-boxoffice",
    "slot": "C_TRADE",
    "source_system_code": "boxoffice",
    "source_system_name": "Boxoffice",
    "system_tier": 1,
    "system_rank": 3,
    "access_disposition": "unavailable",
    "coverage_disposition": "not_verified",
    "assessed_resource_ids": [],
    "coverage_intervals": [],
    "disposition_reason": "Synthetic template marks this canonical system unavailable; replace with a dated real-world access or no-coverage determination before retrieval.",
    "checked_at": "2026-10-19",
    "notes": "Template metadata only; this is not evidence of real archive holdings."
  },
  {
    "inventory_entry_id": "inventory-template-c-trade-motion-picture-daily",
    "slot": "C_TRADE",
    "source_system_code": "motion_picture_daily",
    "source_system_name": "Motion Picture Daily",
    "system_tier": 1,
    "system_rank": 4,
    "access_disposition": "unavailable",
    "coverage_disposition": "not_verified",
    "assessed_resource_ids": [],
    "coverage_intervals": [],
    "disposition_reason": "Synthetic template marks this canonical system unavailable; replace with a dated real-world access or no-coverage determination before retrieval.",
    "checked_at": "2026-10-19",
    "notes": "Template metadata only; this is not evidence of real archive holdings."
  },
  {
    "inventory_entry_id": "inventory-template-c-trade-film-daily",
    "slot": "C_TRADE",
    "source_system_code": "film_daily",
    "source_system_name": "Film Daily",
    "system_tier": 1,
    "system_rank": 5,
    "access_disposition": "unavailable",
    "coverage_disposition": "not_verified",
    "assessed_resource_ids": [],
    "coverage_intervals": [],
    "disposition_reason": "Synthetic template marks this canonical system unavailable; replace with a dated real-world access or no-coverage determination before retrieval.",
    "checked_at": "2026-10-19",
    "notes": "Template metadata only; this is not evidence of real archive holdings."
  },
  {
    "inventory_entry_id": "inventory-template-c-general-new-york-times",
    "slot": "C_GENERAL",
    "source_system_code": "new_york_times",
    "source_system_name": "The New York Times",
    "system_tier": 1,
    "system_rank": 1,
    "access_disposition": "available",
    "coverage_disposition": "documented_intervals",
    "assessed_resource_ids": [
      "resource-template-open"
    ],
    "coverage_intervals": [
      {
        "coverage_interval_id": "coverage-template-c-general-new-york-times",
        "date_dimension": "source_publication_or_issue_date",
        "start_date": "1900-01-01",
        "end_date": "2026-10-19",
        "start_issue": null,
        "end_issue": null,
        "resource_id": "resource-template-open",
        "evidence_basis": "other_documented",
        "evidence_note": "Synthetic fixture interval only; replace with provider- or holdings-specific evidence before retrieval.",
        "documentation_url": "https://example.org/replace-with-coverage-documentation",
        "checked_at": "2026-10-19"
      }
    ],
    "disposition_reason": null,
    "checked_at": "2026-10-19",
    "notes": "Template metadata only; this is not evidence of real archive holdings."
  },
  {
    "inventory_entry_id": "inventory-template-c-general-los-angeles-times",
    "slot": "C_GENERAL",
    "source_system_code": "los_angeles_times",
    "source_system_name": "Los Angeles Times",
    "system_tier": 1,
    "system_rank": 2,
    "access_disposition": "unavailable",
    "coverage_disposition": "not_verified",
    "assessed_resource_ids": [],
    "coverage_intervals": [],
    "disposition_reason": "Synthetic template marks this canonical system unavailable; replace with a dated real-world access or no-coverage determination before retrieval.",
    "checked_at": "2026-10-19",
    "notes": "Template metadata only; this is not evidence of real archive holdings."
  },
  {
    "inventory_entry_id": "inventory-template-c-general-washington-post",
    "slot": "C_GENERAL",
    "source_system_code": "washington_post",
    "source_system_name": "The Washington Post",
    "system_tier": 1,
    "system_rank": 3,
    "access_disposition": "unavailable",
    "coverage_disposition": "not_verified",
    "assessed_resource_ids": [],
    "coverage_intervals": [],
    "disposition_reason": "Synthetic template marks this canonical system unavailable; replace with a dated real-world access or no-coverage determination before retrieval.",
    "checked_at": "2026-10-19",
    "notes": "Template metadata only; this is not evidence of real archive holdings."
  },
  {
    "inventory_entry_id": "inventory-template-c-general-chicago-tribune",
    "slot": "C_GENERAL",
    "source_system_code": "chicago_tribune",
    "source_system_name": "Chicago Tribune",
    "system_tier": 1,
    "system_rank": 4,
    "access_disposition": "unavailable",
    "coverage_disposition": "not_verified",
    "assessed_resource_ids": [],
    "coverage_intervals": [],
    "disposition_reason": "Synthetic template marks this canonical system unavailable; replace with a dated real-world access or no-coverage determination before retrieval.",
    "checked_at": "2026-10-19",
    "notes": "Template metadata only; this is not evidence of real archive holdings."
  },
  {
    "inventory_entry_id": "inventory-template-c-general-christian-science-monitor",
    "slot": "C_GENERAL",
    "source_system_code": "christian_science_monitor",
    "source_system_name": "The Christian Science Monitor",
    "system_tier": 1,
    "system_rank": 5,
    "access_disposition": "unavailable",
    "coverage_disposition": "not_verified",
    "assessed_resource_ids": [],
    "coverage_intervals": [],